video_id,channel_name,video_title,view_count
NgOI2Y2Jc8s,RadioTelevisionofIreland,Is Steven Avery innocent? - Dean Strang | The Ray D'Arcy Show | RTÉ One,77000
eQ0xFVbL6tg,RadioTelevisionofIreland,Aprés Match: Wayne Rooney beats Maradona's record,76000
Z9RYhp6YX-Q,RadioTelevisionofIreland,Republic of Telly: Apparitions at Knock,76000
iwz5Q-IutzU,RadioTelevisionofIreland,Joe Brolly: Donegal are a 'footballing superbug',74000
JXqPjeH1KJI,RadioTelevisionofIreland,Steve Coogan talks about how he puts what he wants to say into his work | RTÉ,73000
hZWzt4xr5p4,RadioTelevisionofIreland,Garageland at Cruinniú na nÓg. Supported by RTÉ.,73000
7JhNP2Jwnm0,RadioTelevisionofIreland,Irish Pole Sport Champions  | The Late Late Show | RTÉ One,72000
P4hfIOrG6U0,RadioTelevisionofIreland,Love/Hate | RTÉ One | ‘I’ll hunt him down for sport.’,72000
Ll3eJkP1OgE,RadioTelevisionofIreland,Naked Camera Unseen - Jake Stevens Gets Lost,72000
ByqVSihS4rw,RadioTelevisionofIreland,RTÉ All Ireland Drama Festival 2021 - The Interval Act,70000
2gYN2XHJH8Y,RadioTelevisionofIreland,The Cork Nativity | RTÉ One and RTÉ Player,70000
rSVr6I8ingE,RadioTelevisionofIreland,Peter Andre v Mrs Brown in arm wrestling! | All Round to Mrs Brown's | RTÉ One,69000
_B-9t85n6ww,RadioTelevisionofIreland,Madeleine Stowe says she was captivated by Revenge,69000
PQxz9dLsHs4,RadioTelevisionofIreland,Mammy's Punch! | All Round to Mrs Brown's | RTÉ One,68000
u6DmF0fxd_E,RadioTelevisionofIreland,Robogarda - Jimmy Saville's Pyjamas - Republic of Telly,67000
PDXPaEZk6NQ,RadioTelevisionofIreland,Last Singer Standing | Saturdays | RTÉ One & RTÉ Player,67000
LVDj62rVNBs,RadioTelevisionofIreland,Naked Camera Unseen - The Psychic,66000
TFMuXudPDOE,RadioTelevisionofIreland,RTÉ | Have your say,66000
y-agieoGdps,RadioTelevisionofIreland,Adam Sandler and Rob Schneider,66000
G3_1rGr4kQc,RadioTelevisionofIreland,Aprés Match: Play It Again Des,65000
MC5n__39lJs,RadioTelevisionofIreland,How Tim Roth got the part of Mr. Orange in 'Reservoir Dogs' | The Late Late Show | RTÉ One,65000
UjfBdkhux5U,RadioTelevisionofIreland,FAIR CITY SNEAK PEEK | Thursday 16th September | RTÉ One,65000
iH4dZ8zk3JU,RadioTelevisionofIreland,Niall Horan gets trolled by Dustin in The Den TV Reunion - RTÉ Does Comic Relief,64000
P-FuUu4HIlo,RadioTelevisionofIreland,"Ger Loughnane on Dublin: ""Pure constipated hurling""",64000
VO0d9F1BJ3Y,RadioTelevisionofIreland,True Crime | On RTÉ Player,63000
I6RIPEWl2OU,RadioTelevisionofIreland,Mary Byrne - Rollin' On the River | The Late Late Show,63000
J-01aiyD7i4,RadioTelevisionofIreland,Jedward EXCLUSIVE! Edward denies Lena Romance,62000
zbAsD7jxsFs,RadioTelevisionofIreland,"The 4 Of Us ""Mary"" | The Late Late Show",62000
bk8YHu6rz58,RadioTelevisionofIreland,Katie Taylor at 15,61000
DQmMZeUkTp0,RadioTelevisionofIreland,Fair City | RTÉ One | Next Week,61000
RGn_-FKkRhc,RadioTelevisionofIreland,Sharon Shannon and Wallis Bird perform Christmas Time Again | The Late Late Show,61000
XL1ffgh0erk,RadioTelevisionofIreland,The Willis Clan - My Favourite Things | The Saturday Night Show | RTÉ One,60000
urDYWOYsWS8,RadioTelevisionofIreland,"Love/Hate | RTÉ One | “Micha, I’m going to talk to Fran now...”",60000
kG5BRcDNAIA,RadioTelevisionofIreland,The O'Donovan brothers first time rowing | Pull Like a Dog | RTÉ One,60000
p66lcZ2XHws,RadioTelevisionofIreland,Love/Hate | RTÉ One | “I’ve a bone to pick with you.”,59000
BoO610PUinc,RadioTelevisionofIreland,Shayne Ward on Simon Cowell and Leona Lewis,59000
tnTMJnLB13k,RadioTelevisionofIreland,Imelda May performs 'The Girl I Used To Be' | The Tommy Tiernan Show | RTÉ One,58000
YlVBXvswRaQ,RadioTelevisionofIreland,Donny Osmond chats about Crazy Horses,58000
wXJC_x2HNBo,RadioTelevisionofIreland,Carrie Fisher on the infamous Star Wars Bikini | The Saturday Night Show | RTÉ One,57000
25ztaV8WuJ8,RadioTelevisionofIreland,Republic of Telly - Darby the Leprechaun  does Arthur's day,57000
Dr1Dijp03n4,RadioTelevisionofIreland,FAIR CITY SNEAK PEEK | Sunday 7th January 2024 | RTÉ,56000
A-Ic14SVGPY,RadioTelevisionofIreland,"Nob Nation's Oliver Callan does Jedward, Eamon Dunphy and Enda Kenny",56000
fVWVZMy0fTA,RadioTelevisionofIreland,Sandra Bullock and Cate Blanchett talk Ocean's 8,56000
r6lmLZzE8ZE,RadioTelevisionofIreland,Feeling Good | The Rose of Tralee 2018,56000
7Hb0w4uprkg,RadioTelevisionofIreland,RTÉ @ Oxegen 2011: Amanda Brunker Interview,55000
bw-qlO8Reb8,RadioTelevisionofIreland,Oliver Callan | The Saturday Night Show,55000
DcTw98dTKvU,RadioTelevisionofIreland,"'Good Morning' from Singing In The Rain, The West End Musical | The Late Late Show",55000
0AfHAOek6ew,RadioTelevisionofIreland,Jackie Healy Rae Give Gaybo a Cap | Cloch Le Carn | RTÉ One,54000
T5qQOAE184w,RadioTelevisionofIreland,Bray's reaction to Katie Taylor's Olympic win,54000
FubBr2bweUs,RadioTelevisionofIreland,Glen Hansard sings 'The Foggy Dew  | The Tommy Tiernan Show | RTÉ One,54000
BDmE0kdU5Ak,RadioTelevisionofIreland,The Eleventh Hour 19th Minute: German News Sketch,54000
HIp-NhwbqDI,RadioTelevisionofIreland,Whelan and Dealin - # 4 Gold - Republic of Telly,53000
C8_O3tIH41g,RadioTelevisionofIreland,FAIR CITY SNEAK PEEK | Thursday 19th October | RTÉ,53000
ZVnX9Oe-y_8,RadioTelevisionofIreland,Faroe Islands 1-4 Republic of Ireland: The Trap Debate,53000
voH4SFxXTcY,RadioTelevisionofIreland,The Hit: Gerry Fleming - The Last Great Love Song,52000
ppEs47ITUpw,RadioTelevisionofIreland,Ryan Sheridan - Upside Down | The Late Late Show,52000
R-cxw_glV-M,RadioTelevisionofIreland,Ricky Tomlinson on Caroline Aherne | The Ray D'Arcy Show | RTÉ One,52000
6J7msA3cUXE,RadioTelevisionofIreland,Christian Louboutin explains why women love shoes,51000
bKGldeyqA5k,RadioTelevisionofIreland,Last Singer Standing | Saturdays | RTÉ One & RTÉ Player,51000
1k6_c0sMojY,RadioTelevisionofIreland,Derry Girls meets Young Offenders | RTÉ at All Together Now,51000
oUQK8CbCl1w,RadioTelevisionofIreland,Back for More | Fair City,51000
o422hBNCQv0,RadioTelevisionofIreland,FAIR CITY SNEAK PEEK | Tuesday 31st August | RTÉ One,50000
aYzHomwxCXc,RadioTelevisionofIreland,Kin - Episode 1 | RTÉ One | Sunday 9:30 PM,50000
IM9Q24PeVZk,RadioTelevisionofIreland,FAIR CITY SNEAK PEAK | Tuesday 30th December | RTÉ One,49000
IeCuoAN6XTM,RadioTelevisionofIreland,Top 10: Most Iconic Oscar Dresses Ever,49000
2PL0jKjxp7k,RadioTelevisionofIreland,What Davy Saw | Ireland's Fittest Family | RTÉ One,49000
sKkxlipGvew,RadioTelevisionofIreland,Linda Martin's reaction to Eurovision drag queen comment Saturday Night Show,49000
Bk6nGkK_vA0,RadioTelevisionofIreland,FAIR CITY SNEAK PEEK | Tuesday 26th October | RTÉ One,48000
sYLT4abm0KM,RadioTelevisionofIreland,The Corrs perform 'SOS',48000
kOXfIQY7uTM,RadioTelevisionofIreland,FAIR CITY SNEAK PEEK | Wednesday 15th September | RTÉ One,48000
vkJ0UeXmI74,RadioTelevisionofIreland,Dolores Keane | The Tommy Tiernan Show | RTÉ One,47000
GKgPoz2kQ34,RadioTelevisionofIreland,Republic of Telly: Budget 2010,47000
ps2a67EOBY4,RadioTelevisionofIreland,The Late Late Show: Donal Óg Cusack,46000
FVDL-UF1kSo,RadioTelevisionofIreland,Naked Camera Unseen - Jake Stevens on a Treadmill,46000
CoH35Tv2yO8,RadioTelevisionofIreland,The Fear - Remember Me Hidden Camera Prank,46000
AGlKFP34oS4,RadioTelevisionofIreland,How To Be Irish - Web Exclusive,46000
pNzIEUCw7IE,RadioTelevisionofIreland,FAIR CITY SNEAK PEEK | Wednesday 10th November | RTÉ One,45000
7OQq4GCIcy4,RadioTelevisionofIreland,FAIR CITY SNEAK PEEK| Thursday 3rd November 2022 | RTÉ,45000
ivXF1MjgyEs,RadioTelevisionofIreland,Pat and Oisin (2000) - The Late Late Toy Show | Top Ten Moments,45000
s6DLYFIb9co,RadioTelevisionofIreland,And so it begins | Love/Hate | RTÉ One,45000
2MnVbDoeUWQ,RadioTelevisionofIreland,The Late Late Show: Ronan Keating,44000
x-fQ5O7eX3U,RadioTelevisionofIreland,Private Practice,44000
VMLmVw_F0Dc,RadioTelevisionofIreland,FAIR CITY SNEAK PEEK | Tuesday 9th January 2024 | RTÉ,44000
kkbo57bpO-Q,RadioTelevisionofIreland,FAIR CITY SNEAK PEEK | Thursday 9th November | RTÉ,44000
cWlN4ZBzVPE,RadioTelevisionofIreland,FAIR CITY SNEAK PEEK | Thursday 23rd September | RTÉ One,44000
iTh9scf1t_A,RadioTelevisionofIreland,FAIR CITY SNEAK PEEK | Thursday 18th January 2024 | RTÉ,43000
UWpeUky0EAk,RadioTelevisionofIreland,Robert Sheehan - Ireland's favourite bad boy!,43000
vFeej0orX3Q,RadioTelevisionofIreland,The 2 Johnnies Do RTÉ Does Comic Relief,43000
EiNldaM02OI,RadioTelevisionofIreland,Dragon's Den | RTÉ One | New Series | Starts Sunday 26th March 9.30pm,43000
m_DTYXVitgI,RadioTelevisionofIreland,Naked Camera Unseen - The Garda,42000
FrIj11joZ9E,RadioTelevisionofIreland,FAIR CITY SNEAK PEEK | Tuesday 16th November,42000
aRCVU0O2Hqk,RadioTelevisionofIreland,FAIR CITY SNEAK PEEK | Sunday 21st January | RTÉ,42000
nC1Tv3G-0O0,RadioTelevisionofIreland,Naked Camera Unseen - The Jumperman,42000
8wch6EmbjqI,RadioTelevisionofIreland,President Michael D Higgins Speech | Ceiliúradh,42000
hLoKB7OlcZM,RadioTelevisionofIreland,RTÉ Sport Euro 2012 Après Match: Prime Time with Miriam,41000
2Pio-TtuU7A,RadioTelevisionofIreland,Budgie breeder Joe shows off his chicks | Pet Island,41000
kbl3P9MJRAE,RadioTelevisionofIreland,Hardy Bucks: Viper II the Sequel - Vipe Harder,41000
FLvIRiTGpqU,RadioTelevisionofIreland,The Late Late Show: Ardal O'Hanlon,41000
0dQrwHFhngQ,RadioTelevisionofIreland,FAIR CITY SNEAK PEEK | Friday 15th December | RTÉ,41000
FFDr3Ya95XQ,RadioTelevisionofIreland,'I don't care about anything else in my career' Katie Price battles the bullies | Ray D'Arcy Show,40000
rEEpQvF3Q4c,RadioTelevisionofIreland,Chic - We Are Family | The Late Late Show WEB EXCLUSIVE,40000
YRqZwhz9sd0,RadioTelevisionofIreland,Smother | New Drama Starts Tonight| RTÉ One & RTÉ Player,40000
tjqnZ2CvePs,RadioTelevisionofIreland,Warren Gatland talks about the Lions Tour and Brian O'Driscoll | The Late Late Show,40000
WrFJVfm83kc,RadioTelevisionofIreland,Republic of Telly - Nuacht Box Set,40000
7Zz3M_GrFBk,RadioTelevisionofIreland,Colm Meaney talks Hell on Wheels and Star Trek | Saturday Night with Miriam | RTÉ One,39000
l0hNdYgMaHI,RadioTelevisionofIreland,Fleadh Cheoil na hÉireann 2019 | RTÉ Official Media Partner,39000
zG73XjlpBxE,RadioTelevisionofIreland,The Late Late Show: Des Bishop,39000
oWkH1MYrlQQ,RadioTelevisionofIreland,Riptide Movement perform 'All Works Out' | The Late Late Show | RTÉ One,39000
9If6SuvIS6I,RadioTelevisionofIreland,FAIR CITY SNEAK PEEK | Thursday 12th August | RTÉ One,39000
60OZJJ3B1xc,RadioTelevisionofIreland,Après Match: The long and the short of it with Brian Cowen and David McWilliams,39000
B-5ap0EKYf4,RadioTelevisionofIreland,FAIR CITY SNEAK PEEK | Thursday 26th October | RTÉ,38000
fmLQ0aUNy88,RadioTelevisionofIreland,"Sinead O'Connor on Prayer, God and a ""Verucca Miracle"" | The Tommy Tiernan Show | RTÉ One",38000
4TNkzROR1FA,RadioTelevisionofIreland,Bull Mick Top Tips for Euro 2012: The After Goal Celebration - Craig Doyle Live,38000
K13QK-yuYjs,RadioTelevisionofIreland,John Hurt talks about aging | The Saturday Night Show,38000
7ZH-PFoMWZI,RadioTelevisionofIreland,FAIR CITY SNEAK PEEK | Tuesday 2nd January 2024 | RTÉ,38000
ZiYpibldbb0,RadioTelevisionofIreland,FAIR CITY SNEAK PEEK | Tuesday 10th October | RTÉ,38000
J76j8nNvlGg,RadioTelevisionofIreland,Republic of Telly: Ryan Republic,38000
L9IRBwbSzfg,RadioTelevisionofIreland,FAIR CITY SNEAK PEEK | Tuesday 31st October | RTÉ,37000
MJYC-Nrl44A,RadioTelevisionofIreland,Friar Alessandro - 'O Santa Notte (O Holy Night)' | The Saturday Night Show Sessions | RTÉ One,37000
EXEVvdQizDU,RadioTelevisionofIreland,FAIR CITY SNEAK PEEK | Thursday 28th December | RTÉ,37000
cPfi37n-zkM,RadioTelevisionofIreland,2014 Dublin Rose's Dropkick Murphy's Dance,37000
98pB9LJriUE,RadioTelevisionofIreland,Mitch Winehouse interview on RTÉ's Today Show,37000
Gf4FIt5DG4g,RadioTelevisionofIreland,Setting Boundaries| Mental Health Lessons | RTÉ Player Original,37000
Ppgwz4IwZ8w,RadioTelevisionofIreland,FAIR CITY SNEAK PEEK | Friday 29th December | RTÉ,36000
C836Xdsdfhw,RadioTelevisionofIreland,The cast of Star Trek talk to RTÉ Entertainment,36000
6NhgrdgFAKk,RadioTelevisionofIreland,Brenda Fricker's Hilarious Oscars Story -  The Tommy Tiernan Show,36000
fKEdV93qcQY,RadioTelevisionofIreland,Joseph O'Connor - Teenage Girls Overheard on the Luas | The Late Late Show | RTÉ One,36000
DmIILQHafys,RadioTelevisionofIreland,The Strypes - Oh What A Shame | The Late Late Show,36000
c9SZGzE1Wec,RadioTelevisionofIreland,FAIR CITY SNEAK PEEK | Thursday 17th March | RTÉ One,36000
KbWemSS-Jyw,RadioTelevisionofIreland,FAIR CITY SNEAK PEEK | Tuesday 4th January | RTÉ ONE,36000
VaMsbVehonw,RadioTelevisionofIreland,Bill Bailey on the Tea-Shock!,35000
MrSw9a9gqMU,RadioTelevisionofIreland,Emma Dabiri on growing up as a young black girl in Dublin | Claire Byrne Live,35000
09rtVkTXGEc,RadioTelevisionofIreland,FAIR CITY SNEAK PEEK | Sunday 25th February | RTÉ,35000
jOdwISnUsYQ,RadioTelevisionofIreland,"""I always knew"" Transgender Jamie O'Herlihy on her childhood | The Ray D'Arcy Show | RTÉ One",35000
-5kG9kzMbOs,RadioTelevisionofIreland,FAIR CITY SNEAK PEEK | Thursday 21st December | RTÉ,35000
-1rutPqIpeo,RadioTelevisionofIreland,FAIR CITY SNEAK PEEK | Tuesday 20th December 2022 | RTÉ,34000
9jpbnLBwlKo,RadioTelevisionofIreland,How prepared are Irish intensive care units - Coronavirus Covid-19? RTÉ Prime Time,34000
cQ5vL8zgo4Y,RadioTelevisionofIreland,"Andre Rieu on his financial difficulties | The Meaning of Life, With Gay Byrne | RTÉ One",34000
H1E9HaM1IuY,RadioTelevisionofIreland,Love/Hate | RTÉ One | ‘She's bleedin' rubbing my nose in it now.’,34000
_iXNuhhK2-Y,RadioTelevisionofIreland,FAIR CITY SNEAK PEEK | Thursday 22nd February | RTÉ,34000
NMNk3sXmhLs,RadioTelevisionofIreland,When Hookie met the lovely Ingrid | The Ray D'Arcy Show | RTÉ One,34000
30Al5LOZ4hM,RadioTelevisionofIreland,Hundreds attend Gerry Ryan's funeral mass,33000
1uhrNzi_7MU,RadioTelevisionofIreland,Naked Camera Unseen - Traffic Warden,33000
QhSgGF99lnk,RadioTelevisionofIreland,First Look: Dancing with the Stars 2024 | RTÉ One & RTÉ Player,33000
D_I0GyIGjaQ,RadioTelevisionofIreland,The Munster Hurling Final: It's Special,33000
UdrUOBrGWHQ,RadioTelevisionofIreland,RTÉ @ Oxegen 2011: Calvin Harris interview,33000
KwTN0NQWu_k,RadioTelevisionofIreland,FAIR CITY SNEAK PEEK | Tuesday 16th January 2024 | RTÉ,33000
3qzwTJZiqBo,RadioTelevisionofIreland,Former Pop Group Six: Where are they now?,33000
U33RvQdxbuE,RadioTelevisionofIreland,“I’m the man Tommy.” 💪💪 | The Tommy Tiernan Show | RTÉ One,33000
KIshop1y3cQ,RadioTelevisionofIreland,John Bishop: 'Imagine YOUR mom reading 50 Shades of Grey!',33000
SYhKFQLj_KU,RadioTelevisionofIreland,Late Late Toy Show - Dirty Bertie,32000
LxUtnb8QlPU,RadioTelevisionofIreland,Aidan O'Shea in the Championship Matters hotseat,32000
PeZBL7h7R0o,RadioTelevisionofIreland,What Kelly Did Next | Thursday Jan 9th | RTÉ Two | 9:30pm,32000
BX-VJTpWNYw,RadioTelevisionofIreland,FAIR CITY SNEAK PEEK | Thursday 7th December | RTÉ,32000
y5LjQVoNXmo,RadioTelevisionofIreland,The Fall | Starts Sunday May 12th | 9:30pm | RTÉ One,32000
JAjBrsxwLoM,RadioTelevisionofIreland,David Gray and the RTÉ Concert Orchestra Perform 'Babylon',32000
2DnPFWUe1XE,RadioTelevisionofIreland,"RTÉ Sport Euro 2012 Après Match: ""The Jack Charlton""",32000
-zM_EJG-Qio,RadioTelevisionofIreland,"Charles Spencer on following his sister, Princess Diana’s coffin | Meaning of Life | RTÉ One",32000
jOusWGrLrdc,RadioTelevisionofIreland,Charlotte Church - Nerve | The Saturday Night Show,31000
b7pGwIbimc4,RadioTelevisionofIreland,Naked Camera Unseen - Jake Stevens orders a burger,31000
MashWgB-Ovo,RadioTelevisionofIreland,FAIR CITY SNEAK PEEK | Sunday 24th September | RTÉ,31000
h21h79Atu_s,RadioTelevisionofIreland,Tommy cracks | Fair City Teaser | RTÉ ONE,31000
YtVWh3TXjfQ,RadioTelevisionofIreland,"The Snapper - ""Suppose a ride's out of the question?"" | RTÉ Player",31000
7XHsQSgSzDw,RadioTelevisionofIreland,Bernard O'Shea reveals Ireland's newest wrestler,31000
flxaQx35dMY,RadioTelevisionofIreland,Mario Rosenstock on The Daily Show,31000
g5fcP38j2LQ,RadioTelevisionofIreland,Little Green Cars | The John Wayne  | The Late Late Show,30000
fZqhFUM9SJM,RadioTelevisionofIreland,Oliver Callan & Miriam O'Callaghan take the Ice Bucket Challenge | Saturday Night With Miriam,30000
cypBEc37mec,RadioTelevisionofIreland,Don't Miss The Savage Eye - Final Episode,30000
h-8FdWQ4l9E,RadioTelevisionofIreland,"David McSavage ""who goes to Plays?"" | The Saturday Night Show | RTÉ One",30000
EAIWEdEss0o,RadioTelevisionofIreland,FAIR CITY SNEAK PEEK | Sunday 3rd December | RTÉ,30000
r84rP2F6tXI,RadioTelevisionofIreland,RTÉ INVESTIGATES: Inside Ireland's Covid Battle | Patrick's Story | Monday 9.35pm | RTÉ One,30000
qFUUP45aSbY,RadioTelevisionofIreland,Brian Deady - Lightning & Thunder | The Late Late Show | RTÉ One,30000
Gq5RnEMn0po,RadioTelevisionofIreland,RTÉ INVESTIGATES: Inside Ireland's Covid Battle | Monday & Tuesday | 9.35pm | RTÉ One,29000
a4ygnlhpmbU,RadioTelevisionofIreland,Quinn Country | RTÉ,29000
3vULFEEYgWA,RadioTelevisionofIreland,Mario Rosenstock does Ray D'Arcy | The Ray D'Arcy Show | RTÉ One,29000
esCqEafYGLk,RadioTelevisionofIreland,The Meaning of Life with Gay Byrne | Richard Dawkins on religious morality,29000
vqOgtf_VVFM,RadioTelevisionofIreland,Eurosong 2013: Aimée - Crashing Down,29000
e5sfD2M2ZPU,RadioTelevisionofIreland,Love/Hate cat appears on Late Late Show,29000
MVTqPl1_X4o,RadioTelevisionofIreland,FAIR CITY SNEAK PEEK | Tuesday 12th December | RTÉ,29000
K4TiQA3dqKY,RadioTelevisionofIreland,Life After Love/Hate? | New Years Eve Live 2014 | RTÉ One,28000
ZFI7RBbzNtQ,RadioTelevisionofIreland,The Late Late Show: Joseph O'Connor on the Irish love of the 'F' word,28000
Ijn4un35W94,RadioTelevisionofIreland,FAIR CITY SNEAK PEEK | Friday 10th February | RTÉ,28000
RsvlONzmGpU,RadioTelevisionofIreland,The Late Late Show: Trash Talking Wrestler to Choir Boy,28000
x0xjpf4paCM,RadioTelevisionofIreland,Their clothes were disgusting | Hell on Wheels | RTÉ Two,28000
Wc7M6KZWjIE,RadioTelevisionofIreland,GAAGO -- Bringing Gaelic Games to Audiences Worldwide,28000
ESI15YEJMRQ,RadioTelevisionofIreland,Almost nabbed for real! | Love/Hate: Season 4 | Sundays | 9.30pm | RTÉ One,28000
M9CC0sjTVgY,RadioTelevisionofIreland,Eurosong 2013: Kasey - Kiss Me,28000
LYl8OKMoHWw,RadioTelevisionofIreland,Aprés Match: Rob Greene,27000
XKHTBHWLdsE,RadioTelevisionofIreland,FAIR CITY SNEAK PEEK | Friday 5th August | RTÉ One,27000
MhjENxBPY_s,RadioTelevisionofIreland,Reginald D. Hunter on why he gets on so well with the Irish,27000
LGv8100l4Gk,RadioTelevisionofIreland,Striking Out | Coming Soon to RTÉ One,27000
cUTiCLmo8qc,RadioTelevisionofIreland,FAIR CITY SNEAK PEEK | Friday 10th November | RTÉ,27000
bIBA4-S67UM,RadioTelevisionofIreland,One-to-One with Miriam O'Callaghan | RTÉ Player,27000
Hmg3AUxWbZo,RadioTelevisionofIreland,Jerry Springer Sings Elvis | The Ray D’Arcy Show | RTÉ One,27000
GoMWeU_tayo,RadioTelevisionofIreland,Majella O'Donnell on her wedding to Daniel | Brendan O'Connor's Time Out | RTÉ One,27000
nzpvJM2DszQ,RadioTelevisionofIreland,Stefanie Preissner on changing her attitude to alcohol | Brendan O'Connor's Cutting Edge | RTÉ One,27000
h70HNVGFisE,RadioTelevisionofIreland,Asylum & Direct Provision  - Explained by Prime Time,26000
u7AYZwHTIVA,RadioTelevisionofIreland,Love / Hate EP2 - Sneak Peek!,26000
bYnCwc_ZxSI,RadioTelevisionofIreland,The Zoo: Expecting mother Maeve the giraffe goes in to labour,26000
FWoAfZ113BA,RadioTelevisionofIreland,Footballer Names | Après Match,26000
Q_ETb0Bh7oY,RadioTelevisionofIreland,Michael Madsen on Really Being Mr.Blonde and Al Pacino's Love Advice,26000
KcJgy0dk_hg,RadioTelevisionofIreland,FAIR CITY SNEAK PEEK | Tuesday 14th September | RTÉ One,26000
1Niw6flh7Fg,RadioTelevisionofIreland,Donncha O'Callaghan on the arrival of his baby boy | The Ray D'Arcy Show | RTÉ One,26000
rURxOc5mMpE,RadioTelevisionofIreland,All-Ireland Camogie | We were there | You were there | RTÉ,26000
ebBPNK7vUNQ,RadioTelevisionofIreland,How singing got Fassbender the Frank gig | The Late Late Show,26000
8lARRahBem8,RadioTelevisionofIreland,The O.C. | Available Now | RTÉ Player,26000
7sHqQ6ubWxk,RadioTelevisionofIreland,Helen Flanagan talks about Michael Le Vell | The Saturday Night Show,25000
CK4gb631p8Y,RadioTelevisionofIreland,The High Kings - Ireland's Shore | The Late Late Show | RTÉ One,25000
4s_NTlmxWy4,RadioTelevisionofIreland,Deady - No Diggity (Blackstreet Cover) - The Late Late Show | Behind the Scenes,25000
pIO0ayu6sck,RadioTelevisionofIreland,Katie Taylor wins RTÉ Sports Person of the Year,25000
AeTTMZCY2F0,RadioTelevisionofIreland,Pundit Island | Après Match,25000
FVrqw7pVJNU,RadioTelevisionofIreland,The Kilmichael Ambush | Episode 3 | The Irish Revolution | RTÉ One,25000
9dYZgllKkpc,RadioTelevisionofIreland,Eleanor Tiernan | We Need to Talk About Ireland,25000
6g_SWrpEJ0o,RadioTelevisionofIreland,Markéta Irglová talks to RTÉ Ten,25000
ZbOgZQfayYU,RadioTelevisionofIreland,Paddy Moloney on the terms of The Chieftains contract,24000
a1JhOEsraaA,RadioTelevisionofIreland,The Doireann Project | RTÉ Player | Brand New Comedy,24000
KxqwM39_DGs,RadioTelevisionofIreland,The Saturday Night Show: Emma Quinlan does 'The Kiss of Death',24000
tYWqzg7mEIk,RadioTelevisionofIreland,New Aviva Stadium opens,24000
1BFrVvkVQl4,RadioTelevisionofIreland,Against The Head on the dropping of Ronan O'Gara,24000
-hdtJzMzm2I,RadioTelevisionofIreland,FAIR CITY SNEAK PEEK | Tuesday 23rd May | RTÉ,24000
pSs437jAsTo,RadioTelevisionofIreland,Paul Carrack and RTÉ's Cór Linn Perform 'The Living Years' | The Ray D'Arcy Show,24000
cz5WQSt_Zqo,RadioTelevisionofIreland,Après Match: Beckham on the bench,24000
C4WVvlWCs9s,RadioTelevisionofIreland,Political correctness and Religion | Brendan O'Connor's Cutting Edge | RTÉ One,24000
5UVGPQ0ofX8,RadioTelevisionofIreland,Love/Hate: Season 4 | Episode 3 | Sundays | 9.30pm | RTÉ One,24000
nkgXN5zNHiw,RadioTelevisionofIreland,Josh Hartnett takes a selfie with a fan on live TV | The Late Late Show,24000
eJUELf9m3HU,RadioTelevisionofIreland,What the children think about taking part in a child beauty pageant | The Late Late Show,24000
tvd-a1qWAOQ,RadioTelevisionofIreland,Dean Rock and Niamh McEvoy on how they first met on the GAA pitch | The Ray D’Arcy Show | RTÉ One,23000
tfq4-gXTB9I,RadioTelevisionofIreland,Laura Whitmore: Irish men are the best in the world!,23000
qcqtIjRTZic,RadioTelevisionofIreland,CeilIúradh - Behind The Scenes,23000
9TKOgqHC6Yg,RadioTelevisionofIreland,Piano Lesson 1 - Instrumental,23000
H23REmQD-W8,RadioTelevisionofIreland,FAIR CITY SNEAK PEEK | Wednesday 21st July | RTÉ One,23000
tW0_7ysPVB8,RadioTelevisionofIreland,Dunphy and Moore Song for Euro 2012,23000
QJ3Q8-nKXnI,RadioTelevisionofIreland,Maigret Sets A Trap | RTÉ One | Friday 12th August 9.35pm,23000
ZSFZ0knSD_Q,RadioTelevisionofIreland,Knockout Entertainment | RTÉ Player,23000
pYtjkBl6C3g,RadioTelevisionofIreland,Nessun Dorma - Classic Irish Football Songs | Euro 2016 | RTÉ Player,23000
JCRasahUuG8,RadioTelevisionofIreland,Love/Hate: Season 4 | Finale | Sunday | 9.30pm | RTÉ One,23000
xa9zJiV8m9U,RadioTelevisionofIreland,What are You Eating? | Thursdays at 8:30pm | RTÉ One,23000
dkamQ4DlB10,RadioTelevisionofIreland,Bressie - Show Me Love | The Late Late Show,22000
KkXBHATdDYE,RadioTelevisionofIreland,World Cup 2010: Sombreros all round!,22000
UPvqRiIGnV4,RadioTelevisionofIreland,"Dara Ó Briain, Britain's Favourite Irishman? | The Late Late Show | RTÉ One",22000
dKfeOe55b-g,RadioTelevisionofIreland,Brian Kennedy Perfoms 'The Boxer'  | The Ray D'Arcy Show | RTÉ One,22000
sJhPPq02mJE,RadioTelevisionofIreland,The Jiving Priest - Fr Pat | Stetsons and Stilettos | RTÉ One,22000
Tr-Os0a6uHY,RadioTelevisionofIreland,Après Match: Des and Bruce,22000
xCx83Ir9hFo,RadioTelevisionofIreland,Lisa Lambe - All We Are | Culture Night 2015 | RTÉ,22000
I6phmk3mjAc,RadioTelevisionofIreland,"The Sunday Game: Niall Quinn, Eadestown manager",22000
IsqgU-awYf8,RadioTelevisionofIreland,Jessie Pavelka talks about Fifty Shades of Grey  | The Saturday Night Show,22000
aB_h8reH-xQ,RadioTelevisionofIreland,When Amy Winehouse Came to Dingle,22000
19sYOKdEnsQ,RadioTelevisionofIreland,David Murphy confronts Michael Fingleton in Dublin Airport,22000
c5ZkH1a-t1w,RadioTelevisionofIreland,Emma Langford performs ‘Birdsong’ | The Tommy Tiernan Show,22000
yFnkjVRdpW8,RadioTelevisionofIreland,"Nathan Carter - ""Ho Hey""",22000
ZpU_HuS3bMg,RadioTelevisionofIreland,Christmas entertainment on RTÉ One,21000
L8AL0OHJyNo,RadioTelevisionofIreland,FAIR CITY SNEAK PEEK | Thursday 29th December | RTÉ ONE,21000
TpB98YgDUK0,RadioTelevisionofIreland,Emma O'Driscoll - Big Bad Handsome Man | The Late Late Show,21000
f3wkNBbAInc,RadioTelevisionofIreland,FAIR CITY SNEAK PEEK | Wednesday 18th August | RTÉ One,21000
hvvp13qxkdQ,RadioTelevisionofIreland,RTÉ ONE - A BRAND NEW SEASON 2013/14,21000
puYDqCxXr48,RadioTelevisionofIreland,Girls Outperform Boys in the Leaving Cert,21000
U3cePrcHUFQ,RadioTelevisionofIreland,Hook and Pope: Breakfast Buddies,21000
lES4LU5nmTY,RadioTelevisionofIreland,Bosco | We were there | You were there | RTÉ,21000
5p0GSTnHhUo,RadioTelevisionofIreland,Obituary | New Series | RTÉ,21000
70QAAaaHST0,RadioTelevisionofIreland,Bull Mick Top Tips for Euro 2012: Penalties - Craig Doyle Live,21000
x5Nwe2Md_6U,RadioTelevisionofIreland,James Vincent McMorrow - Gold | The Late Late Show,21000
Ee2PsHGnvaQ,RadioTelevisionofIreland,Fair City: The Moments That Changed Everything,21000
PkfyF7e0DS0,RadioTelevisionofIreland,Wayne returns an engaged man | Fair City Teaser | RTÉ ONE,21000
2Vwu_I7Ke9Q,RadioTelevisionofIreland,Naked Camera Unseen - The Jumperman,20000
