video_id,channel_name,video_title,view_count
K2y78QnBKKs,TheJournal,TheJournal.ie: 'Things will settle down',76
YRKuufuM_AY,TheJournal,Timelapse Of Earth From The International Space Station,73
kCP5zM-a6II,TheJournal,What Irish Universities Make From Student Contributions,67
qG3K4BUXKmc,TheJournal,Scientists have said that we need to drastically change how we eat in order to save the planet,60
IYr-yRIOlUA,TheJournal,Tánaiste Eamon Gilmore on the economic strategy,58
3B7Tnkgfh3M,TheJournal,TheJournal.ie: Minister of State Jan O'Sullivan on Labour's left-wing stance,56
e5UZCLqv7OY,TheJournal,TheJournal.ie: Howlin on CRC and Irish Water,50
HrjY396g5js,TheJournal,The Newest Member of the Fota Family,46
sbCiT0Pe7-E,TheJournal,TheJournal.ie Michael Noonan on ability to pay back debt,39
cKauyKmxsI4,TheJournal,Photos of This Week's Supermoon,32
SQ0BKLGO2Rk,TheJournal,TheJournal.ie: Minister Ring crictises credit card data breach,27
SiA0pSbvpNA,TheJournal,TheJournal.ie: Dublin Lord Mayor would consider entering national politics,6
jG-_EH371rE,TheJournal,How a Dublin knitting group helped these premature twins,2700
vn6u1YQqTpk,TheJournal,The House of Commons has been suspended due to a (very loud) water leak coming from the ceiling.,2300
18vlun6zbXk,TheJournal,Vox Pop: Do you know who's who in Leo Varadkar's Cabinet?,2000
9-q4mwp1smI,TheJournal,"Bríd Smith elected: 'The workers, united, will never be defeated.'",2000
6kRUnLoCAM0,TheJournal,The Fall and Rebirth of Boland's Mill Dublin,1400
dO-_CNPjZ-Y,TheJournal,Skellig Michael from the air,1400
0kZ_ZhpcJ0A,TheJournal,TheJournal.ie: Dublin Lord Mayor Christy Burke on Sinn Féin in government,1000
Oy9aFDzLPqc,TheJournal,Healthcare: the power of patient advocacy | Open Newsroom,864
iRF80gPG11U,TheJournal,TheJournal.ie: Full interview with Labour Minister Ged Nash,170
xgdXfIPkJH8,TheJournal,Meet Stevie II - Ireland's first AI robot designed to help care for older people,7400
WzTlm6UIpH0,TheJournal,Noel Grealish TD accused of 'disgraceful racism' in the Dáil,7100
8f49zXYW8kk,TheJournal,Danny Healy Rae: 'Eating a big meal and driving can cause an accident',6500
HAFVoutE3nc,TheJournal,TheJournal.ie: 'Barroom-brawl on Dáil's last day',5800
5zQ-veKNeEk,TheJournal,Rainbow Vigil in Dublin To Remember Orlando Nightclub Victims,5000
h8Psiv1iGIQ,TheJournal,Micheál Martin mimics Pearse Doherty during rowdy Leaders' Questions,4100
58Qf3b936X0,TheJournal,Dr Susan Delaney on whether bereaved people need counselling,3000
BpM4I1MPhXc,TheJournal,Extensive damaged caused to non-profit club in Cork,3000
nAA9CAymNr8,TheJournal,Dáil ructions between Sinn Féin's Pearse Doherty and Finance Minister Michael McGrath.,2600
k2sO_cyTv2Q,TheJournal,Here's why Thomas Pringle left Sinn Féin almost a decade ago,2300
bkao0vBZ3wc,TheJournal,Minister Roderic O'Gorman delivers opening International Women's Day remarks to en empty Dáíl,1700
jum1eNuNeXU,TheJournal,Simon Coveney on why he should be Taoiseach,1600
7gA2CXgy58s,TheJournal,Justice Minister Simon Harris says there is 'direct link' between casual drug use and criminality,1400
H5ljfm8UznQ,TheJournal,Starting to look a bit like Christmas....Watch the Christmas Lights go up on Henry Street,1400
3VU5uVCCHpM,TheJournal,TheJournal.ie: Dublin's Lord Mayor talks about being in prison,1200
J8kxq8ET6h4,TheJournal,Derval O'Rourke's top 5 tips for packing a healthy lunch,1200
owx03YWXs8M,TheJournal,TheJournal ie: John Lyons on being one of the few openly gay TDs,1100
-cRHxGCmr8I,TheJournal,TheJournal.ie: Ronan Lyons on the Dublin rental market,886
gHHEcdKELmM,TheJournal,Should Ireland Introduce A Sugar Tax?,792
Hq_a9xmt2gk,TheJournal,TheJournal.ie: Full interview with Alex White,753
DUgOWq8_6F8,TheJournal,TheJournal.ie: Ryanair CEO Michael O'Leary on upcoming UKCC Case,659
bOFEEcfObK4,TheJournal,Older Dubliners on improving their health with new exercise programme,630
L5DLm9rE7n0,TheJournal,Cervical Check: Acting HSE boss says sorry for 'confusion and alarm',618
w0LhypyxSSc,TheJournal,Mary Lou McDonald: Fianna Fáil should call for general election,491
0N4RJTIaHAo,TheJournal,Open Newsroom: How can Ireland fix the housing crisis?,415
ZkygHSb1t5A,TheJournal,TheJournal.ie: Brian Hayes has sympathy for John Perry,227
QNBfWFLzo70,TheJournal,Minister Howlin on whether recent by-election performances are a sign of voter unhappiness,144
gOFwdh6OJxQ,TheJournal,Rúbaí Trailer,53000
NVGtYuBWa2M,TheJournal,Wicklow seafront at high tide,12000
IAZ0SynCT8Q,TheJournal,"Mattie McGrath asked to leave Oireachtas committee, 26.06.2012",11000
NtO80k0Hm-c,TheJournal,Two new rollercoasters planned for Emerald Park's 'Tir na nÓg',9100
2vfKD_haQPI,TheJournal,TheJournal ie: We asked Enda Kenny why he's worth €185k,5800
AvJl-qEjqHw,TheJournal,Leo Varadkar announces he is stepping down as Taoiseach,5000
Lop4j-OrlRA,TheJournal,'Ireland is a dangerous place for women to live': Pauline McLynn on the Eighth Amendment,4200
gZEdMOOhWRY,TheJournal,"Manna delivery drones landing, being refilled and taking off in Dublin",4100
GmcFJ6EomqU,TheJournal,Fake Art Gallery Robbery Causes Panic Among Museum Customers,4000
sCfg0ZWeTTw,TheJournal,TheJournal.ie: Caitriona and Gary from Cork Penny Dinners,3800
SxfT81hMlg4,TheJournal,Ever tried to reinvent the wheel? One Young Scientist is doing just that,3600
q2Yj-Wy__-4,TheJournal,What are the referendums on 8 March about?,3300
VtcDCVID0Hc,TheJournal,Petition seeks to stop sale of Nama site,3000
qU1VLzVL3BU,TheJournal,These writings in Dublin might be the oldest surviving records of early Christian texts,2800
odbugGDexbA,TheJournal,This futuristic pod is making college life easier for students with autism,2400
Bkdwqph7S4M,TheJournal,"By day, John Shevlin makes hats, but once a year he transforms into James Joyce",2400
nse6paC4bxs,TheJournal,TheJournal.ie: Ballet Ireland's Nutcracker rehearsals,2300
yDCY2zpH5Zc,TheJournal,'Children really don't have a voice': what it means to volunteer at Childline,2000
RoKpE6e8LnM,TheJournal,'There's no way to express how happy we are at seeing the Pope',2000
2gZsLiTJa0M,TheJournal,TheJournal.ie: Mary Lou McDonald on water charges,1700
PTrROLbMzPU,TheJournal,"Varadkar: ""My reasons for stepping down are both personal and political""",1400
6NDtd0fGYYI,TheJournal,Emergency services at the scene after an envelope of white powder was sent to the Health Department,1400
u09PnnEfRUA,TheJournal,TheJournal.ie: How Revenue will locate homes undervalued for Property Tax,1300
bPZNLNSfYo8,TheJournal,'These people need to be held to account',1200
wNEAPRCz_44,TheJournal,Things are looking up for bees in Ireland,1200
_NTTh_Q7V4c,TheJournal,An evening on the doorsteps in Dublin’s North Inner City (Part 2),1200
TGKMQNSlqiM,TheJournal,Heading to Croke Park next weekend? Whet your appetite with a video visit to this 'U2 room',1100
RpXlc7Kkun8,TheJournal,Pope-a-scopes and John Paul II's in-flight menu: Uncovering the curios of the '79 visit,1000
xX1-KprlYx0,TheJournal,Mary Mitchell O'Connor: 'There is sexism and bullying in the Dáil',948
Myj4F2Z13zc,TheJournal,Dublin Bay North recount goes on and on,863
XcwTqCwYtrI,TheJournal,TheJournal.ie: Noise from the Luas works on Dawson St,857
DowUx5DSays,TheJournal,TheJournal.ie: Joan Burton on cannabis legalisation,794
FKY72QdO38Y,TheJournal,"Gender equality, Ireland, the EU and you | Open Newsroom",631
14JaZMCImpE,TheJournal,TheJournal ie: 8th Amendment 'should be removed',590
_FY1rDqKZhM,TheJournal,Nellie The Elephant Raised In The Dáil,549
YvPqKZMQOvM,TheJournal,Your questions put to the Referendum Commission,542
yZpUBWF2eRc,TheJournal,#GE16 Talking Points Sunday Evening,490
Zj-wphi-W2E,TheJournal,TheJournal.ie: Ruth Coppinger TD talk about pro-life reaction to the Abortion Pill Bus,471
VWZiGZGSO_4,TheJournal,In full: Joe Biden delivers inauguration address,399
Jzu1ybqnPig,TheJournal,TheJournal.ie: Protest moves from Kildare Street to Trinity College Dublin,389
I2jOf_RgOLA,TheJournal,TheJournal ie: Elected mayor for Dublin,169
OFVdGQmu93w,TheJournal,She was right: How Catherine Corless uncovered what happened in Tuam,12000
3nAMDaHB9lM,TheJournal,TheJournal.ie: Irish unity inevitable,12000
T1sJI5a7fCk,TheJournal,Pearse Doherty speaking at Creeslough,4400
bhkh0XUKg0s,TheJournal,TheJournal.ie Derek Byrne Dublin Says No,3600
xZbCGfk3W7k,TheJournal,TheJournal ie: Aine Collins on Lapgate,3400
JAH5uP7N-Qw,TheJournal,The connection between Beethoven and birdsong,1600
yHBGDyjtTBY,TheJournal,Will Martin McGuinness ever talk about shooting anybody?,1200
wzrrUXxBvFA,TheJournal,What's the best piece of advice your mother ever gave you?,1200
UF7FofUi0mI,TheJournal,TheJournal.ie: Will Irish Water be using debt collectors?,1100
_rl0ZZolEGo,TheJournal,TheJournal.ie: Parenting expert Colman Noctor answers YOUR questions,1100
F5oR8J8XyYk,TheJournal,TheJournal.ie: Peter Coonan explains why he played two characters in The Guarantee,962
2C8_1g7Gxws,TheJournal,TheJournal.ie: Vox pop at Irish Senior Citizens Parliament protest,913
YCP5MYM-K1o,TheJournal,John Connors and Mark O'Connor on Cardboard Gangsters,744
mcMbUUGQihs,TheJournal,TheJournal.ie: Ronan Lyons on the Irish rental market,498
MWRsLz_2-CE,TheJournal,TheJournal ie: Toilet tissue-gate,226
mRvAwdO5r8U,TheJournal,TheJournal.ie: Joan Burton arrives at Henry Street Dunnes where she worked as a student.,1100
SPB6LTWThH4,IrishTimes,Mícheál Ó Muircheartaigh making a ham sandwich,895000
OiXG19gttw8,IrishTimes,'She was fierce in the best sort of way': Dubliners turn out to pay tribute to Sinéad O'Connor,108000
Jh_Ar8vtSmA,IrishTimes,"Irish college students talk about sex, rape and consent",81000
dBUwKJg6weQ,IrishTimes,Olivia Palermo visits Kildare Village,75000
-7z0D9U1vO4,IrishTimes,'Big Banjo Bash' brings hundreds of banjo players onto the streets of Mullingar,53000
fImXnGGdYQ4,IrishTimes,"irishtimes.com & Risteard Cooper - Eddie O'Sullivan is ""Ryled""",43000
6l2UEV_-Fu4,IrishTimes,irishtimes.com: Eviction in Killiney,41000
ItEN8z1AEZk,IrishTimes,irishtimes.com: Man dies after incident on Dawson Street,37000
lEqJrqr9WU8,IrishTimes,"Who is the Latvian MEP, linked to Daly and Wallace, accused of working with Russian intelligence?",4100
oXul6TtEHwA,IrishTimes,"‘I empower children through puppetry, to give them a voice’: Carmel Balfe, puppeteer",78
KQBdQJZvN-o,IrishTimes,"Coffee firelighters, air fryers, and lithium batteries: day two of BT Young Scientist Exhibition",223
MDQGg8q2eCU,IrishTimes,Wren Day: 'It's all about tradition',309
ZbXok5WexGo,IrishTimes,'We've grown 700-800% in the last few years': An Post sees record demands on parcel deliveries,745
oJwsT1pp9B0,IrishTimes,Anti-semitism in Ireland: 'There's been a huge uptick',1600
XJu3WTBRwSU,IrishTimes,Art collective create two new murals to highlight debate around 'Public Art Bill',322
3u-Lp_5EPXg,IrishTimes,Suzanne Lynch gets to the heart of the new reality in Europe,36000
3rbuLn-Y8KM,IrishTimes,irishtimes.com & Risteard Cooper: 'Gavin' Dempsey and Ireland sidelined on the ITV bench,34000
QBypzggcrOs,IrishTimes,Home to vote: Ireland’s exiles return to cast their vote,31000
pklAu69bnL0,IrishTimes,"Fintan O’Toole, irishtimes.com TV ad",26000
ypywjvNmc_k,IrishTimes,Irish Navy feel 'complete indifference from official Ireland',24000
8Zw3_HAurf4,IrishTimes,The Dublin riots: How they unfolded hour by hour,23000
R87g9WZdWH8,IrishTimes,Irish Times - Best Place to Live in Ireland - Ardara,20000
LWqA9xB6C7k,IrishTimes,irishtimes.com: Dublin Zoo gorillas,17000
XkvWVJ4XOXk,IrishTimes,Bertie Ahern arrives at Fianna Fail ardfheis,16000
PfHODCNfQbM,IrishTimes,The Irish Times Student Offer,15000
-kfYSgVjPdw,IrishTimes,Ireland and the UK: our relationship in numbers,14000
eqLBV5DBMgk,IrishTimes,Our Test Drive: the Volvo V60,12000
1Xf3UVvpNFk,IrishTimes,Our Test Drive: INEOS Grenadier Utility Wagon,11000
t8qDs8xySxg,IrishTimes,United Ireland: How Nationalists and Unionists Fought Together in Flanders,10000
TsSgf2ZOTf0,IrishTimes,David Norris withdraws his bid for nomination for Irish presidency,10000
0b3FbkdVOl0,IrishTimes,Giovanni Trapattoni talks about the 4-0 defeat to Spain,9300
-rAWmhlqNI0,IrishTimes,irishtimes.com: The things people say about water,9100
77ayfeeWVBM,IrishTimes,irishtimes.com: Leap Card's Test Run,8500
DikYeqEWk-M,IrishTimes,Irishtimes.com: Six Nations: Ireland 32 Scotland 14,7700
JfBt4e3IQZA,IrishTimes,'You never forget you are under water': An inside look at commercial diving,7200
pJIX5ribiHE,IrishTimes,irishtimes.com: Croke Park roof top tour,6900
3BC9IE9Ke40,IrishTimes,'It's going to be unreal': Ballina gears up for Joe Biden's visit,6600
56OxlNAupi0,IrishTimes,Herbert Simms: The architect who changed the streets of Dublin,6400
VJWTYg1vfMI,IrishTimes,"Anti-water charge protest, Dublin - March 21st 2015",5900
HEw-QmtmsJo,IrishTimes,irishtimes.com: Michael D Higgins interview,5500
NaO_pBZYZJE,IrishTimes,Irish Times fiscal treaty debate,5400
_9BhRDJQEJQ,IrishTimes,"'It's very, very, dangerous': Delivery riders suffer serial assaults in Dublin city",5200
mAofSJzJC8M,IrishTimes,'We knew we had the Phantom in front of us': Paul Mescal's 2012 stage appearance,5000
YQ2LuK_MbxM,IrishTimes,Labour's Michael D Higgins arrives at Dublin Castle,4900
xIGMcVYds9Q,IrishTimes,Trump complains about legal woes while visiting his Irish golf course,4700
-Guwp2fnf7U,IrishTimes,Hail Glorious Queen Master,4600
z1zS7NZIYOY,IrishTimes,Irishtimes.com: Gay Pride Parade Dublin 2012,4500
oD6OBsric0o,IrishTimes,Gerry Thornley analyses Ireland team to face Wales,4300
s--mR-DytbU,IrishTimes,irishtimes.com: No Man is an Island,4100
p9cg54b0q34,IrishTimes,"'You're upside down, inside out, flying across the midlands': the life of an Irish Air Corps pilot",4000
IzL5Nqi_XR4,IrishTimes,Berkeley tragedy: Mourners pay respects to young students,3800
3Lgm-xxlMm4,IrishTimes,'Mayo for Sam' declares Joe Biden in Ballina,3800
R45o24gmQMM,IrishTimes,irishtimes.com: Ireland squad announcement,3700
VJP0x2Ih6lY,IrishTimes,Irishtimes.com: BoI agrees mortgage write-down,3500
Aof5E5v-yns,IrishTimes,"Visit the home of new musical festival, All Together Now",3400
U-Li4ggGLWk,IrishTimes,irishtimes.com: Diarmuid Martin on Holy See comments,3300
1KO2RVVtRvQ,IrishTimes,Election count at the RDS,3200
zcx3Zp59R-c,IrishTimes,Eoghan Daltun's Irish Atlantic rainforest,3100
aRkPOIOCkn8,IrishTimes,Our Test Drive: the Jeep Renegade,3000
Lu89d5sPdRU,IrishTimes,irishtimes.com: Republic of Ireland reach Euro 2012 play-offs,2800
PTnySFR50Cs,IrishTimes,Circle of Peace - Dublin,2700
bFdmEvNknR8,IrishTimes,irishtimes.com: Patsy McGarry pays tribute to Mary Raftery,2600
LrGrs44so3M,IrishTimes,Go aboard a 'Ghost Gator': the USS Mesa Verde docks in Dublin,2500
vurXIn74Z34,IrishTimes,Irishtimes.com: President Michael D Higgins votes on fiscal treaty,2500
IaM5aWgBnng,IrishTimes,Skoda MissionL at the Frankfurt Motor Show 2011,2400
_rrOUJ0FGI0,IrishTimes,"Weather Tuesday, Wednesday, Thursday, Friday",2300
UKIGtEvsOHI,IrishTimes,Martin McGuinness congratulates Michael D Higgins,2300
Am2h0n7XS9E,IrishTimes,‘My mission is to record all of the bird species in Ireland’,2200
1jr67JisL_w,IrishTimes,Irish-Palestinian father reunited with children after wife killed in Gaza,2200
MgsYPZTPV-E,IrishTimes,Our Test Drive: the Alfa Romeo Stelvio Quadrifoglio,2100
A71ZfXk187k,IrishTimes,Ireland’s oldest woman turns 109: 'I'm rich in the company I have',2100
uEsjOigDaTI,IrishTimes,Tathony House eviction: 'There's a very real prospect of emergency accommodation',2000
uuU9pRjC-Yo,IrishTimes,irishtimes.com: Accepting your CAO offer,2000
gqIwOFO_zFY,IrishTimes,irishtimes.com: How consumers can save money,2000
ckicNO3TV04,IrishTimes,irishtimes.com Republic of Ireland v Czech Republic team announcement,1900
S4H1ZP7uvCs,IrishTimes,irishtimes.com: Mary Lou McDonald concedes,1900
G-P72il58yU,IrishTimes,irishtimes.com: Dan O'Brien assesses latest CSO data on economy,1900
lZcVtPsKats,IrishTimes,Irishtimes.com: Liss Ard Festival Launch,1800
z9UG8rKKwkE,IrishTimes,Our Test Drive: the Volkswagen T-Roc,1700
cn6aFJAGXt8,IrishTimes,irishtimes.com: EBS workers begin strike action,1700
rQ9uXLaynB0,IrishTimes,Irishtimes.com: Powers Short Story competition winner,1700
kM3qWZ8hmqQ,IrishTimes,Christmas shoppers arrive in Dublin,1600
bcPlXcZ-Zaw,IrishTimes,irishtimes.com: Dana announces Aras bid,1600
Se5Wv38tgMA,IrishTimes,Irishtimes.com: Analysis of points for CAO courses,1600
HrsAJJkMlIw,IrishTimes,Prospects for the Irish property market,1600
OHEOxQERhXw,IrishTimes,"Weather forecast for Wednesday, February 12th",1600
ie28fvG3Y5I,IrishTimes,Making the Irish Kickboxing team,1500
kTUXUdP7-hE,IrishTimes,National Ploughing Championships,1500
RUH8i2hd-H4,IrishTimes,Gerry Adams: The UK Government is 'destroying the human rights elements of the GFA',1500
Yth2RAwoKLM,IrishTimes,Charlie Bird: 'Thank you from the very bottom of my heart',1400
PL5j9zGinsU,IrishTimes,Social welfare cuts in the budget,1400
xXxyoYmGFFQ,IrishTimes,Irishtimes.com: CAO 2012,1400
zKhIf_Oh_7k,IrishTimes,Dan O'Brien on the anniversary of the banking guarantee,1400
TCa50cHigbg,IrishTimes,"Body found in Trooperstown Wood, Co Wicklow.",1400
ZdUV50IEtWE,IrishTimes,irishtimes.com: Gerry Thornley previews Ireland's trip to Twickenham,1400
n8PbxlpGICY,IrishTimes,Hyundai i40,1400
AtnALiTfHKQ,IrishTimes,Frank McNally looks at life on Tory Island,1300
MD2FivVxmnw,IrishTimes,'There's no other scheme like this in Europe': Work commences on new cycle route in Dublin,1300
I1VjXTfUJ7Q,IrishTimes,Paddy Car Sales,1300
TKRzq0EcFOs,IrishTimes,Smart Ping Pong at Frankfurt IAA 2011,1300
76gztw7jIpM,IrishTimes,Fighting the climate crisis with trees: Meet some of Ireland's 'rewilders',1300
xOa9bCMlB4s,IrishTimes,irishtimes.com Bike to Work Day,1300
hi3yHh-hoLg,IrishTimes,irishtimes.com: Dublin Bus protest,1200
AxD-HvEHKp0,IrishTimes,Fiona Doyle speaks to the press after meeting Taoiseach Enda Kenny,1200
zFpR6rg7-pI,IrishTimes,irishtimes.com: Census 2011 overview,1200
EPk0iOmbMUM,IrishTimes,Cern director general on the Higgs search,1200
sMhdismj-fk,IrishTimes,Irish Times Debate Belfast 2013**,1100
lwkpvPj3BC8,IrishTimes,irishtimes.com: Shay Given,1100
KHQjdQVDhh8,IrishTimes,Our Test Drive: the Audi A7,1100
u0EOlxpT3WY,IrishTimes,Harry McGee discusses the Irish economy,1100
n8d3mZBvGT0,IrishTimes,Irishtimes.com: Generation Next - College Graduates,1100
ybhYgj095ic,IrishTimes,irishtimes.com: National Standards for the Protection and Welfare of Children,1100
-MRAshftDKw,IrishTimes,Irishtimes.com: Light House Cinema reopens,1000
7mITtKWET9M,IrishTimes,Stephen Donnelly discusses bank bailout protest,1000
0f-o6gjDa7U,IrishTimes,irishtimes.com: Nevan Lahart art exhibit Temple Bar Gallery,1000
LBH3CwVmih0,IrishTimes,21st Century Baby: Assisted reproduction in Ireland,1000
amwhWIGCAIk,IrishTimes,David Norris congratulates Michael D. Higgins in Dublin Castle,1000
giCDBb-2vxM,IrishTimes,'I hope my reward is in the next world': The Irish faith-healer who practices from his pub,1000
rU3umtE4hd4,IrishTimes,irishtimes.com: Norris criticises Government policy on mortgage debt,1000
oXFpdYq62vw,IrishTimes,'We’ve lost so much’: John Bhaba Jack O’Chonghaola's quest to preserve the old ways,999
douuMpu9guk,IrishTimes,Audits of  child protection in six Catholic dioceses,990
WchuMJq0JGI,IrishTimes,David Shing talks about what's next,981
dvl9WFtQueM,IrishTimes,On the campaign trail: Mary Davis,959
gexSdm_5gxQ,IrishTimes,irishtimes.com: Harry McGee analyses referendum result,956
MHa1amAo3RI,IrishTimes,irishtimes.com: Dan O'Brien on the National Accounts and Export Figures,948
foNDopHQMig,IrishTimes,ADW - Pricks and Mortar,937
H5g9afg2wiQ,IrishTimes,Protesters from Newtownmountkennedy,920
aP8fmDV1Jkc,IrishTimes,Education cuts in the budget,904
OwjAJFk1knY,IrishTimes,'There is no plan': Tourist towns feel the strain of accommodating Ukrainians,896
B_SeDfFug9w,IrishTimes,The Irish Times Sportswomen Of The Year 2021,876
h2zy7KPjvPI,IrishTimes,The Irish Times Digital Challenge: Week 6,871
SOLNyNUl2LA,IrishTimes,irishtimes.com: September 11th anniversary marked in Dublin,861
Sh3PguGRAf8,IrishTimes,LGBT Noise stages civil marriage protest,843
n0g3l0aYwsU,IrishTimes,Garrett Byrne of Langton's Hotel cooking healthy food,839
M4Q7rEo64Tg,IrishTimes,irishtimes.com: Dan O'Brien assesses the latest exchequer data,833
65Z06YuW4sY,IrishTimes,Parties comment on Dublin West Byelection,814
4SXB3R3-vBU,IrishTimes,Our Test Drive: the Peugeot 308 GTI,800
exJYo5RtdOc,IrishTimes,Arthur's Day 2012,788
tIFpwaFhgS8,IrishTimes,Workers show solidarity with victims of recent attacks in Dublin,758
qt8ghZ56HWQ,IrishTimes,irishtimes.com: Micheál Martin Mahon Q&A,749
xS9kFegRZPs,IrishTimes,National Gallery Refurbishment,734
B0nLvELVnFU,IrishTimes,Republic of Ireland pre-match press conference,724
5wPLAfziEF4,IrishTimes,"Weather forecast, Friday, March 7th + Weekend Outlook",713
Y_7NtL3TXqE,IrishTimes,'There's no room for self-pity': Michael O'Regan on his experience of cancer,709
-dxIbtYRnYc,IrishTimes,irishtimes.com: Stephen Collins analyses Constituency Commission report,702
prb2q11TzC8,IrishTimes,New exhibition features work by trail-blazing female artist Lavinia Fontana,696
Un3Mm0XD-3M,IrishTimes,"Weather forecast Friday, February 7th & weekend outlook",689
KKIvLYGsR-I,IrishTimes,Irishtimes.com: Rob Kelly Rap,677
zxOFvyCsfsU,IrishTimes,"Weather forecast, Thursday, February 13th",666
DkC0HgLQyVM,IrishTimes,"Weather forecast, Friday, May 9th + Weekend Outlook",652
944VUbyNNgA,IrishTimes,Weather forecast for Friday June 4th & Weekend,647
Vcve2KoZkNI,IrishTimes,Political correspondent Deaglán de Bréadún on the election count,636
qgNy-0BmEgI,IrishTimes,'We have people in their 50s and 60s coming in': Tattoo boom continues in Dublin,629
Ezu7ukXcMW4,IrishTimes,'Hold up your red card',625
_IW9DxFDb-s,IrishTimes,irishtimes.com: Deaglán de Bréadún,618
DdrJmqxQhRE,IrishTimes,Weather forecast Friday July 18th + Weekend Outlook,604
2_H81Zxi1uA,IrishTimes,Weather forecast for Christmas Eve + Christmas Outlook,587
7u6amg1wj4A,IrishTimes,How pensions are affected by the budget,573
GLRaZ2MiwUs,IrishTimes,Irishtimes.com: Fiscal Treaty Campaign Overview Part 1,563
HrwlXalUJG8,IrishTimes,Pet dogs blessed for Christmas at Christchurch Cathedral,559
SPg0L39n0SE,IrishTimes,irishtimes.com: Crisis in second-level maths,547
c0zFabNN1xY,IrishTimes,Higgs - where does it all fit in?,537
3j1a28-Ct8Q,IrishTimes,Our Test Drive: the Nissan Micra,529
H55Vk8iXtRk,IrishTimes,"Weather forecast for Friday, December 6th & Weekend",519
SeBM8d_z-UM,IrishTimes,Weather forecast for Friday November 29th,516
SEAaaJ8yhLQ,IrishTimes,"Weather forecast for Friday, December 20th & Weekend",505
tJTtH5THnHU,IrishTimes,Simon Harris on the cusp of becoming next Taoiseach,632
x27aWJvoPts,IrishTimes,Smart Chemistry- Tasty Food,484
vzcAX81yQ9Y,IrishTimes,Squad Announcement to face Wales,478
3wt24t5yFPw,IrishTimes,Conference on Irish Economic Policy,471
DuRFWY9UG1Q,IrishTimes,Irishtimes.com: Generation Next - School leavers,462
VzfiNr23-8Y,IrishTimes,"RTÉ will be insolvent by spring without multi-million bailout, says Bakhurst",452
rcu6sgpAYhc,IrishTimes,"Weather Forecast, November 22nd and Weekend Outlook",444
vyHQBfNLy18,IrishTimes,Dublin Web Summit - Paddy Cosgrave,436
ZVeRcRVvVv0,IrishTimes,Weather forecast Thursday July 3rd,435
9CKQnYhw6bU,IrishTimes,Thousands attend austerity protest in Dublin,433
R8xmOYqNL8k,IrishTimes,Referendums views: 'You'd have a nervous breakdown being in the home 24/7',415
nWs4HswgreU,IrishTimes,2011 Grandparent of the Year,406
p4xigobGXmo,IrishTimes,Enda Kenny on the Legal Services Bill,401
n0IQWafXdEU,IrishTimes,Watch US president Joe Biden's Oireachtas address in full,394
CdlvZ_lFwIk,IrishTimes,"Weather forecast Friday, May 16th + Weekend Outlook",385
QbpnY1MhMLk,IrishTimes,irishtimes.com: Retail sales fall 3.6%,377
h0kZWNcWyRk,IrishTimes,"Weather forecast, Wednesday, March 5th",364
-9F0gTKTin0,IrishTimes,Christmas Week Weather 2014,359
JHboRFx5b3g,IrishTimes,'A good dog is everything really’: Shepherd Paul Walker,355
lmd7JtaxOJA,IrishTimes,"Weather Forecast, Friday October 4th and Weekend Outlook",352
6KvrLjOoh14,IrishTimes,Weather forecast Thursday June 19th,349
7JUcsdqrno8,IrishTimes,"Weather forecast Tuesday, March 18th",343
qdLEU6yQLck,IrishTimes,"Weather Forecast, Wednesday July 16th",338
KfG8zn3xRBg,IrishTimes,The main questions facing Ireland ahead of the Six Nations,330
15IOzO4dekc,IrishTimes,How a community group restored a castle over 35 years,323
Zs6Xpn4OQBE,IrishTimes,Weather Forecast Tuesday July 22nd,320
bLFNOTKvnDM,IrishTimes,"Weather forecast for Tuesday, October 29th",315
Zab57j29f2s,IrishTimes,Minister for Health James Reilly discusses HSE funding deficit,312
10wuRDRMPj0,IrishTimes,"Weather forecast for Wednesday, January 8th",309
Tuik0S3jNlQ,IrishTimes,Weather forecast Tuesday July 8th,302
62_QcfSt2LY,IrishTimes,'Not as terrifying as I'd expected': Shauna Bowers takes a Dublin Bus driving lesson,299
JvLyvtLNG10,IrishTimes,"Friday, Saturday, Sunday, Monday Weather",292
k2gnYjZxi3k,IrishTimes,"Weather forecast for Monday, November 11th",290
rFDZwOEQz3Y,IrishTimes,'What I Do': Sean Garvey concertina maker and musician,284
RRjiGG4ePtA,IrishTimes,"weather forecast Thursday, March 13th",279
Wgn1EILXVyQ,IrishTimes,"Weather Forecast, Thursday, October 24th",276
QagD_F9DZ-s,IrishTimes,Weather Forecast Monday July 14th,274
WnE_a4-rnac,IrishTimes,"Weather forecast for Wednesday, November 20th",272
GSR5eeKqbkY,IrishTimes,"Weather forecast, Tuesday June 3rd",269
wCVI4pCw06c,IrishTimes,Theatre-maker Luke Casserly's work 'Distillation' explores Ireland's relationship with the bog,270
ySVqOcjInIo,IrishTimes,Ethan Beard talks Facebook,265
rXCiivpwf9g,IrishTimes,"Weather forecast for Wednesday, December 18th",263
1SGLUzuD3JE,IrishTimes,Weather Forecast Thursday June 26th,261
hgNvgrWH1AU,IrishTimes,"Weather forecast for Friday, June 7th & Weekend",257
